{
  "name": "convert-fiber-orientations",
  "source": {
    "type": "mrtrix",
    "path": "mrtrix.json"
  },
  "exe": "wb_command",
  "args": [
    "-convert-fiber-orientations"
  ],
  "docs": {
    "description": "Convert bingham parameter volumes to fiber orientation file.\n\nTakes precomputed bingham parameters from volume files and converts them to the format workbench uses for display.  The <label-volume> argument must be a label volume, where the labels use these strings:\n\n\nCORTEX_LEFT\nCORTEX_RIGHT\nCEREBELLUM\nACCUMBENS_LEFT\nACCUMBENS_RIGHT\nALL_GREY_MATTER\nALL_WHITE_MATTER\nAMYGDALA_LEFT\nAMYGDALA_RIGHT\nBRAIN_STEM\nCAUDATE_LEFT\nCAUDATE_RIGHT\nCEREBELLAR_WHITE_MATTER_LEFT\nCEREBELLAR_WHITE_MATTER_RIGHT\nCEREBELLUM_LEFT\nCEREBELLUM_RIGHT\nCEREBRAL_WHITE_MATTER_LEFT\nCEREBRAL_WHITE_MATTER_RIGHT\nCORTEX\nDIENCEPHALON_VENTRAL_LEFT\nDIENCEPHALON_VENTRAL_RIGHT\nHIPPOCAMPUS_LEFT\nHIPPOCAMPUS_RIGHT\nHIPPOCAMPUS_DENTATE_LEFT\nHIPPOCAMPUS_DENTATE_RIGHT\nINVALID\nOTHER\nOTHER_GREY_MATTER\nOTHER_WHITE_MATTER\nPALLIDUM_LEFT\nPALLIDUM_RIGHT\nPUTAMEN_LEFT\nPUTAMEN_RIGHT\nTHALAMUS_LEFT\nTHALAMUS_RIGHT"
  }
}