{
  "name": "border-to-rois",
  "source": {
    "type": "boutiques",
    "path": "boutiques.json"
  },
  "exe": "wb_command",
  "args": [
    "-border-to-rois"
  ],
  "docs": {
    "description": "Make metric rois from borders.\n\nBy default, draws ROIs inside all borders in the border file, as separate metric columns."
  }
}
