{
  "name": "convert-matrix4-to-workbench-sparse",
  "source": {
    "type": "mrtrix",
    "path": "mrtrix.json"
  },
  "exe": "wb_command",
  "args": [
    "-convert-matrix4-to-workbench-sparse"
  ],
  "docs": {
    "description": "Convert a 3-file matrix4 to a workbench sparse file.\n\nConverts the matrix 4 output of probtrackx to workbench sparse file format.  Exactly one of -surface-seeds and -volume-seeds must be specified."
  }
}