{
  "name": "foci-list-coords",
  "source": {
    "type": "mrtrix",
    "path": "mrtrix.json"
  },
  "exe": "wb_command",
  "args": [
    "-foci-list-coords"
  ],
  "docs": {
    "description": "Output foci coordinates in a text file.\n\nOutput the coordinates for every focus in the foci file, and optionally the focus names in a second text file."
  }
}