{
  "name": "foci-get-projection-vertex",
  "source": {
    "type": "mrtrix",
    "path": "mrtrix.json"
  },
  "exe": "wb_command",
  "args": [
    "-foci-get-projection-vertex"
  ],
  "docs": {
    "description": "Get projection vertex for foci.\n\nFor each focus, a column is created in <metric-out>, and the vertex with the most influence on its projection is assigned a value of 1 in that column, with all other vertices 0.  If -name is used, only one focus will be used."
  }
}