{
  "name": "volume-merge",
  "source": {
    "type": "boutiques",
    "path": "boutiques.json"
  },
  "exe": "wb_command",
  "args": [
    "-volume-merge"
  ],
  "docs": {
    "description": "Merge volume files into a new file.\n\nTakes one or more volume files and constructs a new volume file by concatenating subvolumes from them.  The input volume files must have the same volume space.\n\nExample: wb_command -volume-merge out.nii -volume first.nii -subvolume 1 -volume second.nii\n\nThis example would take the first subvolume from first.nii, followed by all subvolumes from second.nii, and write these to out.nii."
  }
}
