{
  "name": "scene-file-relocate",
  "source": {
    "type": "workbench",
    "path": "workbench.json"
  },
  "exe": "wb_command",
  "args": [
    "-scene-file-relocate"
  ],
  "docs": {
    "description": "Recreate scene file in new location.\n\nScene files contain internal relative paths, such that moving or copying a scene file will cause it to lose track of the files it refers to.  This command makes a modified copy of the scene file, changing the relative paths to refer to the new relative locations of the files."
  }
}