{
  "name": "gifti-all-labels-to-rois",
  "source": {
    "type": "workbench",
    "path": "workbench.json"
  },
  "exe": "wb_command",
  "args": [
    "-gifti-all-labels-to-rois"
  ],
  "docs": {
    "description": "Make rois from all labels in a gifti column.\n\nThe output metric file has a column for each label in the specified input map, other than the ??? label, each of which contains an ROI of all vertices that are set to the corresponding label."
  }
}